{
  "series_id": "DMI_NATIONAL_QUINTILE",
  "start_period": "2011-01",
  "end_period": "2026-09",
  "geography": "US",
  "grouping": "quintile",
  "observations_count": 935,
  "observations": [
    {
      "period": "2011-01",
      "group_id": "Q1",
      "dmi": 10.807057782561394,
      "inflation": 1.7070577825613942,
      "slack": 9.1,
      "weights_vintage": 2023
    },
    {
      "period": "2011-01",
      "group_id": "Q2",
      "dmi": 10.895693231381777,
      "inflation": 1.7956932313817786,
      "slack": 9.1,
      "weights_vintage": 2023
    },
    {
      "period": "2011-01",
      "group_id": "Q3",
      "dmi": 10.995917306723893,
      "inflation": 1.8959173067238932,
      "slack": 9.1,
      "weights_vintage": 2023
    },
    {
      "period": "2011-01",
      "group_id": "Q4",
      "dmi": 11.015654936461864,
      "inflation": 1.9156549364618636,
      "slack": 9.1,
      "weights_vintage": 2023
    },
    {
      "period": "2011-01",
      "group_id": "Q5",
      "dmi": 10.989712889059437,
      "inflation": 1.8897128890594361,
      "slack": 9.1,
      "weights_vintage": 2023
    },
    {
      "period": "2011-02",
      "group_id": "Q1",
      "dmi": 11.153409382536008,
      "inflation": 2.153409382536009,
      "slack": 9.0,
      "weights_vintage": 2023
    },
    {
      "period": "2011-02",
      "group_id": "Q2",
      "dmi": 11.269539780914865,
      "inflation": 2.2695397809148643,
      "slack": 9.0,
      "weights_vintage": 2023
    },
    {
      "period": "2011-02",
      "group_id": "Q3",
      "dmi": 11.40506235327298,
      "inflation": 2.40506235327298,
      "slack": 9.0,
      "weights_vintage": 2023
    },
    {
      "period": "2011-02",
      "group_id": "Q4",
      "dmi": 11.435743131827039,
      "inflation": 2.4357431318270395,
      "slack": 9.0,
      "weights_vintage": 2023
    },
    {
      "period": "2011-02",
      "group_id": "Q5",
      "dmi": 11.418783486491737,
      "inflation": 2.418783486491738,
      "slack": 9.0,
      "weights_vintage": 2023
    },
    {
      "period": "2011-03",
      "group_id": "Q1",
      "dmi": 11.664464168787028,
      "inflation": 2.6644641687870285,
      "slack": 9.0,
      "weights_vintage": 2023
    },
    {
      "period": "2011-03",
      "group_id": "Q2",
      "dmi": 11.826688080998707,
      "inflation": 2.826688080998707,
      "slack": 9.0,
      "weights_vintage": 2023
    },
    {
      "period": "2011-03",
      "group_id": "Q3",
      "dmi": 12.025048309563338,
      "inflation": 3.0250483095633385,
      "slack": 9.0,
      "weights_vintage": 2023
    },
    {
      "period": "2011-03",
      "group_id": "Q4",
      "dmi": 12.075195543122234,
      "inflation": 3.0751955431222333,
      "slack": 9.0,
      "weights_vintage": 2023
    },
    {
      "period": "2011-03",
      "group_id": "Q5",
      "dmi": 12.06712059863763,
      "inflation": 3.0671205986376293,
      "slack": 9.0,
      "weights_vintage": 2023
    },
    {
      "period": "2011-04",
      "group_id": "Q1",
      "dmi": 12.164543915598028,
      "inflation": 3.064543915598028,
      "slack": 9.1,
      "weights_vintage": 2023
    },
    {
      "period": "2011-04",
      "group_id": "Q2",
      "dmi": 12.360028830653905,
      "inflation": 3.260028830653905,
      "slack": 9.1,
      "weights_vintage": 2023
    },
    {
      "period": "2011-04",
      "group_id": "Q3",
      "dmi": 12.598977626358668,
      "inflation": 3.498977626358668,
      "slack": 9.1,
      "weights_vintage": 2023
    },
    {
      "period": "2011-04",
      "group_id": "Q4",
      "dmi": 12.662762405717224,
      "inflation": 3.5627624057172236,
      "slack": 9.1,
      "weights_vintage": 2023
    },
    {
      "period": "2011-04",
      "group_id": "Q5",
      "dmi": 12.654129387649029,
      "inflation": 3.55412938764903,
      "slack": 9.1,
      "weights_vintage": 2023
    },
    {
      "period": "2011-05",
      "group_id": "Q1",
      "dmi": 12.405895849952746,
      "inflation": 3.4058958499527447,
      "slack": 9.0,
      "weights_vintage": 2023
    },
    {
      "period": "2011-05",
      "group_id": "Q2",
      "dmi": 12.617342993634898,
      "inflation": 3.6173429936348978,
      "slack": 9.0,
      "weights_vintage": 2023
    },
    {
      "period": "2011-05",
      "group_id": "Q3",
      "dmi": 12.884681291633175,
      "inflation": 3.884681291633174,
      "slack": 9.0,
      "weights_vintage": 2023
    },
    {
      "period": "2011-05",
      "group_id": "Q4",
      "dmi": 12.961411789580872,
      "inflation": 3.961411789580871,
      "slack": 9.0,
      "weights_vintage": 2023
    },
    {
      "period": "2011-05",
      "group_id": "Q5",
      "dmi": 12.960398301810365,
      "inflation": 3.960398301810364,
      "slack": 9.0,
      "weights_vintage": 2023
    },
    {
      "period": "2011-06",
      "group_id": "Q1",
      "dmi": 12.5610913925186,
      "inflation": 3.4610913925186004,
      "slack": 9.1,
      "weights_vintage": 2023
    },
    {
      "period": "2011-06",
      "group_id": "Q2",
      "dmi": 12.757921901226336,
      "inflation": 3.6579219012263353,
      "slack": 9.1,
      "weights_vintage": 2023
    },
    {
      "period": "2011-06",
      "group_id": "Q3",
      "dmi": 13.010237732117893,
      "inflation": 3.910237732117894,
      "slack": 9.1,
      "weights_vintage": 2023
    },
    {
      "period": "2011-06",
      "group_id": "Q4",
      "dmi": 13.084799408744388,
      "inflation": 3.9847994087443883,
      "slack": 9.1,
      "weights_vintage": 2023
    },
    {
      "period": "2011-06",
      "group_id": "Q5",
      "dmi": 13.072730822193936,
      "inflation": 3.9727308221939373,
      "slack": 9.1,
      "weights_vintage": 2023
    },
    {
      "period": "2011-07",
      "group_id": "Q1",
      "dmi": 12.601209488754886,
      "inflation": 3.6012094887548862,
      "slack": 9.0,
      "weights_vintage": 2023
    },
    {
      "period": "2011-07",
      "group_id": "Q2",
      "dmi": 12.776957807516034,
      "inflation": 3.776957807516035,
      "slack": 9.0,
      "weights_vintage": 2023
    },
    {
      "period": "2011-07",
      "group_id": "Q3",
      "dmi": 13.009286799397117,
      "inflation": 4.009286799397116,
      "slack": 9.0,
      "weights_vintage": 2023
    },
    {
      "period": "2011-07",
      "group_id": "Q4",
      "dmi": 13.080596586552442,
      "inflation": 4.080596586552443,
      "slack": 9.0,
      "weights_vintage": 2023
    },
    {
      "period": "2011-07",
      "group_id": "Q5",
      "dmi": 13.050622672353654,
      "inflation": 4.050622672353654,
      "slack": 9.0,
      "weights_vintage": 2023
    },
    {
      "period": "2011-08",
      "group_id": "Q1",
      "dmi": 12.781314687969783,
      "inflation": 3.7813146879697834,
      "slack": 9.0,
      "weights_vintage": 2023
    },
    {
      "period": "2011-08",
      "group_id": "Q2",
      "dmi": 12.944922685575868,
      "inflation": 3.944922685575869,
      "slack": 9.0,
      "weights_vintage": 2023
    },
    {
      "period": "2011-08",
      "group_id": "Q3",
      "dmi": 13.16700085276618,
      "inflation": 4.167000852766178,
      "slack": 9.0,
      "weights_vintage": 2023
    },
    {
      "period": "2011-08",
      "group_id": "Q4",
      "dmi": 13.239652526942027,
      "inflation": 4.239652526942028,
      "slack": 9.0,
      "weights_vintage": 2023
    },
    {
      "period": "2011-08",
      "group_id": "Q5",
      "dmi": 13.203432064659097,
      "inflation": 4.203432064659096,
      "slack": 9.0,
      "weights_vintage": 2023
    },
    {
      "period": "2011-09",
      "group_id": "Q1",
      "dmi": 12.876406285809253,
      "inflation": 3.876406285809253,
      "slack": 9.0,
      "weights_vintage": 2023
    },
    {
      "period": "2011-09",
      "group_id": "Q2",
      "dmi": 13.044231791975372,
      "inflation": 4.044231791975372,
      "slack": 9.0,
      "weights_vintage": 2023
    },
    {
      "period": "2011-09",
      "group_id": "Q3",
      "dmi": 13.26813567826423,
      "inflation": 4.268135678264229,
      "slack": 9.0,
      "weights_vintage": 2023
    },
    {
      "period": "2011-09",
      "group_id": "Q4",
      "dmi": 13.340131157187056,
      "inflation": 4.340131157187055,
      "slack": 9.0,
      "weights_vintage": 2023
    },
    {
      "period": "2011-09",
      "group_id": "Q5",
      "dmi": 13.3091960524126,
      "inflation": 4.3091960524126005,
      "slack": 9.0,
      "weights_vintage": 2023
    },
    {
      "period": "2011-10",
      "group_id": "Q1",
      "dmi": 12.442921551733004,
      "inflation": 3.6429215517330027,
      "slack": 8.8,
      "weights_vintage": 2023
    },
    {
      "period": "2011-10",
      "group_id": "Q2",
      "dmi": 12.559839111487186,
      "inflation": 3.7598391114871843,
      "slack": 8.8,
      "weights_vintage": 2023
    },
    {
      "period": "2011-10",
      "group_id": "Q3",
      "dmi": 12.716415736473722,
      "inflation": 3.9164157364737218,
      "slack": 8.8,
      "weights_vintage": 2023
    },
    {
      "period": "2011-10",
      "group_id": "Q4",
      "dmi": 12.768478965720323,
      "inflation": 3.9684789657203234,
      "slack": 8.8,
      "weights_vintage": 2023
    },
    {
      "period": "2011-10",
      "group_id": "Q5",
      "dmi": 12.716319442463268,
      "inflation": 3.9163194424632675,
      "slack": 8.8,
      "weights_vintage": 2023
    },
    {
      "period": "2011-11",
      "group_id": "Q1",
      "dmi": 12.138258922417169,
      "inflation": 3.53825892241717,
      "slack": 8.6,
      "weights_vintage": 2023
    },
    {
      "period": "2011-11",
      "group_id": "Q2",
      "dmi": 12.233657412773304,
      "inflation": 3.6336574127733057,
      "slack": 8.6,
      "weights_vintage": 2023
    },
    {
      "period": "2011-11",
      "group_id": "Q3",
      "dmi": 12.35994943735216,
      "inflation": 3.7599494373521614,
      "slack": 8.6,